[
  {
    "id": "CONTRACT-001",
    "title": "Migrate recognition and album identity contracts to category-neutral identities",
    "summary": "Replace car-specific identity fields with a versioned category identity that supports scientific names while preserving album/archive compatibility.",
    "objective": "Let the existing application foundation consume Lepidoptera labels without hardcoding one recognition category.",
    "context": "The original contract uses make/model fields; the accepted plan requires CategoryIdentity with category ID, stable class ID, scientific name, display name, and optional alternate names.",
    "owner_role": "Contract Steward",
    "lane": "shared-contracts",
    "repo_target": "categorizer",
    "status": "ready",
    "priority": "P0",
    "milestone": "MVP foundation",
    "allowed_areas": [
      "shared/domain/**",
      "docs/architecture/**",
      "verification/contracts/**"
    ],
    "depends_on": [],
    "inputs": [
      "assembly/generated/project_spec.json",
      "assembly/generated/repo_plan.json",
      "assembly/generated/agent_prompts.json"
    ],
    "outputs": [
      "Versioned Kotlin domain types",
      "RecognitionEngine and AlbumRepository interfaces",
      "Documented invariants, error states, and ownership boundaries",
      "Contract unit tests"
    ],
    "implementation_notes": [
      "Represent uncertain and unsupported results explicitly.",
      "Keep platform types, database entities, ONNX tensors, and UI state out of shared domain contracts.",
      "Use stable class IDs rather than display names as identity keys."
    ],
    "acceptance_criteria": [
      "Recognition candidates and album entries use CategoryIdentity without car-only required fields.",
      "Existing stored car identities have a documented backward-compatible decoding or migration rule.",
      "The fake engine and contract fixtures include Lepidoptera identities and reject unknown category/class combinations.",
      "Serialization and archive versions change only where required and are documented."
    ],
    "verification": [
      "Run shared serialization and contract fixture tests.",
      "Run archive backward-compatibility tests using existing car fixtures.",
      "Validate category/class identity uniqueness and required scientific-name fields."
    ],
    "proof_required": [
      "Test output",
      "API documentation or architecture decision"
    ],
    "edge_cases": [
      "Empty candidate list",
      "Duplicate class IDs",
      "Manual identity outside the model catalog",
      "Clock and date normalization"
    ],
    "non_goals": [
      "Database implementation",
      "UI state implementation",
      "ONNX inference implementation"
    ],
    "estimated_size": "M",
    "risk_tags": [
      "shared-contract",
      "parallelization"
    ]
  },
  {
    "id": "DEC-001",
    "title": "Accept the licensed Lepidoptera catalog, dataset, and checkpoint candidate",
    "summary": "Pin the CC BY 4.0 Figshare dataset record, define the 163-class MVP boundary, and admit the exact MaxViT-T checkpoint only for provenance and mobile qualification.",
    "objective": "Provide an auditable category and artifact boundary without downloading the full 315 GiB image collection.",
    "context": "The accepted MVP amendment replaces cars with Austrian butterflies and moths while preserving car artifacts for post-MVP work.",
    "owner_role": "Contract Steward",
    "lane": "decisions",
    "repo_target": "categorizer",
    "status": "ready",
    "priority": "P0",
    "milestone": "MVP foundation",
    "allowed_areas": [
      "docs/ml/**",
      "ml/catalog/**",
      "models/*.json"
    ],
    "depends_on": [],
    "blocks": [
      "CONTRACT-002"
    ],
    "inputs": [
      "Merged Lepidoptera requirements amendment",
      "Figshare article 29135618 metadata",
      "Scientific Data validation paper",
      "Published training repository"
    ],
    "outputs": [
      "Accepted 163-class scientific-name catalog",
      "Dataset/checkpoint license and attribution record",
      "Pinned checkpoint identity and acquisition policy"
    ],
    "implementation_notes": [
      "Treat dataset images, annotations, pretrained weights, and generated model weights as separately licensed artifacts.",
      "Do not equate public download access with permission to redistribute.",
      "Include generation or approximate-year distinctions only where the accepted product scope requires them."
    ],
    "acceptance_criteria": [
      "The catalog contains exactly the source classes with at least 50 expert-validated images.",
      "The dataset record, article, scripts, and checkpoint licenses are treated as distinct artifacts.",
      "The checkpoint file ID, size, source URL, and published MD5 are pinned before download.",
      "Full dataset acquisition remains conditional on checkpoint qualification or approved distillation."
    ],
    "verification": [
      "Validate catalog uniqueness and exact source-count threshold.",
      "Re-fetch Figshare metadata and compare immutable artifact fields.",
      "Confirm CC BY 4.0 attribution requirements are represented in model/application notices.",
      "Confirm no raw dataset or model binary is committed."
    ],
    "proof_required": [
      "Catalog validation output",
      "Figshare metadata snapshot and hashes",
      "License/provenance decision"
    ],
    "edge_cases": [
      "Multiple names for the same generation",
      "Classes with insufficient licensed examples",
      "Dataset labels that collapse generations required by the MVP"
    ],
    "non_goals": [
      "Downloading all species archives",
      "Approving the checkpoint as a release model",
      "Deleting or rewriting post-MVP car assets"
    ],
    "estimated_size": "M",
    "risk_tags": [
      "licensing",
      "dataset",
      "product-scope"
    ],
    "handoff_notes": "ML work must consume the accepted stable class IDs and license conclusions without renaming classes silently."
  },
  {
    "id": "DEC-002",
    "title": "Select the Android benchmark device and measurement protocol",
    "summary": "Choose the representative Android 10+ mid-range device and define a reproducible cold/warm inference measurement protocol.",
    "objective": "Give the accepted two-second median inference threshold a concrete hardware and measurement reference.",
    "context": "The planning package requires a selected device but intentionally leaves the exact device open.",
    "owner_role": "Contract Steward",
    "lane": "decisions",
    "repo_target": "categorizer",
    "status": "ready",
    "priority": "P0",
    "milestone": "MVP foundation",
    "allowed_areas": [
      "docs/verification/**",
      "verification/device/**"
    ],
    "depends_on": [],
    "inputs": [
      "Accepted Android 10+, recent mid-range, approximately 4 GB RAM device boundary",
      "Accepted median inference below two seconds signal"
    ],
    "outputs": [
      "Benchmark-device decision record",
      "Measurement protocol covering setup, warmup, sample count, timings, and result format"
    ],
    "implementation_notes": [
      "Record model name, chipset, RAM, Android version, ABI, and relevant power/performance settings.",
      "Separate image decoding/preprocessing, session initialization, and inference timing so results are interpretable."
    ],
    "acceptance_criteria": [
      "A physically available or otherwise guaranteed-access benchmark device is named with reproducible specifications.",
      "The protocol defines cold and warm paths, warmup, minimum sample count, percentile/median reporting, and failure handling.",
      "The human owner confirms access to the selected device."
    ],
    "verification": [
      "Review the protocol against the project acceptance signal.",
      "Run a no-model dry run or fixture timing harness if device access is already available."
    ],
    "proof_required": [
      "Accepted device record",
      "Versioned benchmark protocol"
    ],
    "edge_cases": [
      "Thermal throttling",
      "Battery saver",
      "First-run model extraction",
      "Background applications affecting measurements"
    ],
    "non_goals": [
      "Selecting every supported test device",
      "Meeting the latency gate before a candidate model exists"
    ],
    "estimated_size": "S",
    "risk_tags": [
      "hardware",
      "performance",
      "acceptance-gate"
    ]
  },
  {
    "id": "DEC-003",
    "title": "Set the bundled application and model size budget",
    "summary": "Define accepted download, installed, model-file, and runtime-memory budgets for the closed-testing build.",
    "objective": "Bound model selection and quantization decisions with explicit release constraints.",
    "context": "The merged planning package leaves the bundled-size budget unresolved while requiring a bundled offline model.",
    "owner_role": "Contract Steward",
    "lane": "decisions",
    "repo_target": "categorizer",
    "status": "ready",
    "priority": "P0",
    "milestone": "MVP foundation",
    "allowed_areas": [
      "docs/architecture/**",
      "docs/verification/**",
      "verification/release/**"
    ],
    "depends_on": [],
    "inputs": [
      "Google Play closed-testing target",
      "Bundled offline model requirement",
      "Supported approximately 4 GB RAM device boundary"
    ],
    "outputs": [
      "Accepted size and memory budget decision record",
      "A measurement checklist for release artifacts and runtime memory"
    ],
    "implementation_notes": [
      "Keep compressed download size, installed size, ONNX file size, peak resident memory, and inference working memory distinct.",
      "Document which metric is a hard gate and which is an optimization target."
    ],
    "acceptance_criteria": [
      "Numeric budgets are recorded for model file, download package, installed footprint, and peak runtime memory.",